[
  {
    "cluster_id": "N_087",
    "street_name": "Daimlerstraße",
    "plz": "41462",
    "address_range": "1 - 339",
    "building_count_total": 216,
    "sfh_total_ratio": 0.8935,
    "mfh_ratio": 0.0046,
    "other_ratio": 0.1019,
    "structure_profile": "SFH_DOMINANT",
    "structure_gate": "PASS",
    "gate_reason": "LOW_MFH_HIGH_SFH",
    "general_rank_score": 0.8582,
    "general_rank": 1,
    "general_band": "HIGH",
    "ranking_reason_primary": "HIGH_SFH_RATIO",
    "ranking_reason_secondary": "NONE",
    "ranking_universe": "PASS_ONLY"
  },
  {
    "cluster_id": "N_467",
    "street_name": "Daimlerstraße",
    "plz": "41462",
    "address_range": "6 - 99a",
    "building_count_total": 216,
    "sfh_total_ratio": 0.8935,
    "mfh_ratio": 0.0046,
    "other_ratio": 0.1019,
    "structure_profile": "SFH_DOMINANT",
    "structure_gate": "PASS",
    "gate_reason": "LOW_MFH_HIGH_SFH",
    "general_rank_score": 0.8582,
    "general_rank": 2,
    "general_band": "HIGH",
    "ranking_reason_primary": "HIGH_SFH_RATIO",
    "ranking_reason_secondary": "NONE",
    "ranking_universe": "PASS_ONLY"
  },
  {
    "cluster_id": "N_413",
    "street_name": "Carl-Sonnenschein-Straße",
    "plz": "41466",
    "address_range": "1 - 93",
    "building_count_total": 67,
    "sfh_total_ratio": 1.0,
    "mfh_ratio": 0.0,
    "other_ratio": 0.0,
    "structure_profile": "SFH_DOMINANT",
    "structure_gate": "PASS",
    "gate_reason": "LOW_MFH_HIGH_SFH",
    "general_rank_score": 0.7901,
    "general_rank": 3,
    "general_band": "HIGH",
    "ranking_reason_primary": "HIGH_SFH_RATIO",
    "ranking_reason_secondary": "NONE",
    "ranking_universe": "PASS_ONLY"
  },
  {
    "cluster_id": "N_485",
    "street_name": "Goldregenweg",
    "plz": "41468",
    "address_range": "1 - 67",
    "building_count_total": 60,
    "sfh_total_ratio": 1.0,
    "mfh_ratio": 0.0,
    "other_ratio": 0.0,
    "structure_profile": "SFH_DOMINANT",
    "structure_gate": "PASS",
    "gate_reason": "LOW_MFH_HIGH_SFH",
    "general_rank_score": 0.7803,
    "general_rank": 4,
    "general_band": "HIGH",
    "ranking_reason_primary": "HIGH_SFH_RATIO",
    "ranking_reason_secondary": "NONE",
    "ranking_universe": "PASS_ONLY"
  },
  {
    "cluster_id": "N_420",
    "street_name": "Bongarder Hof",
    "plz": "41470",
    "address_range": "1 - 81",
    "building_count_total": 75,
    "sfh_total_ratio": 0.9867,
    "mfh_ratio": 0.0133,
    "other_ratio": 0.0,
    "structure_profile": "SFH_DOMINANT",
    "structure_gate": "PASS",
    "gate_reason": "LOW_MFH_HIGH_SFH",
    "general_rank_score": 0.7772,
    "general_rank": 5,
    "general_band": "HIGH",
    "ranking_reason_primary": "HIGH_SFH_RATIO",
    "ranking_reason_secondary": "NONE",
    "ranking_universe": "PASS_ONLY"
  },
  {
    "cluster_id": "N_046",
    "street_name": "Abteiweg",
    "plz": "41468",
    "address_range": "2 - 67",
    "building_count_total": 56,
    "sfh_total_ratio": 1.0,
    "mfh_ratio": 0.0,
    "other_ratio": 0.0,
    "structure_profile": "SFH_DOMINANT",
    "structure_gate": "PASS",
    "gate_reason": "LOW_MFH_HIGH_SFH",
    "general_rank_score": 0.7746,
    "general_rank": 6,
    "general_band": "HIGH",
    "ranking_reason_primary": "HIGH_SFH_RATIO",
    "ranking_reason_secondary": "NONE",
    "ranking_universe": "PASS_ONLY"
  },
  {
    "cluster_id": "N_219",
    "street_name": "Itterstraße",
    "plz": "41469",
    "address_range": "1 - 100",
    "building_count_total": 56,
    "sfh_total_ratio": 1.0,
    "mfh_ratio": 0.0,
    "other_ratio": 0.0,
    "structure_profile": "SFH_DOMINANT",
    "structure_gate": "PASS",
    "gate_reason": "LOW_MFH_HIGH_SFH",
    "general_rank_score": 0.7746,
    "general_rank": 7,
    "general_band": "HIGH",
    "ranking_reason_primary": "HIGH_SFH_RATIO",
    "ranking_reason_secondary": "NONE",
    "ranking_universe": "PASS_ONLY"
  },
  {
    "cluster_id": "N_358",
    "street_name": "Ulmenallee",
    "plz": "41469",
    "address_range": "2 - 112",
    "building_count_total": 56,
    "sfh_total_ratio": 1.0,
    "mfh_ratio": 0.0,
    "other_ratio": 0.0,
    "structure_profile": "SFH_DOMINANT",
    "structure_gate": "PASS",
    "gate_reason": "LOW_MFH_HIGH_SFH",
    "general_rank_score": 0.7746,
    "general_rank": 8,
    "general_band": "HIGH",
    "ranking_reason_primary": "HIGH_SFH_RATIO",
    "ranking_reason_secondary": "NONE",
    "ranking_universe": "PASS_ONLY"
  },
  {
    "cluster_id": "N_015",
    "street_name": "Franz-Leuninger-Straße",
    "plz": "41466",
    "address_range": "1 - 52",
    "building_count_total": 53,
    "sfh_total_ratio": 1.0,
    "mfh_ratio": 0.0,
    "other_ratio": 0.0,
    "structure_profile": "SFH_DOMINANT",
    "structure_gate": "PASS",
    "gate_reason": "LOW_MFH_HIGH_SFH",
    "general_rank_score": 0.7704,
    "general_rank": 9,
    "general_band": "HIGH",
    "ranking_reason_primary": "HIGH_SFH_RATIO",
    "ranking_reason_secondary": "NONE",
    "ranking_universe": "PASS_ONLY"
  },
  {
    "cluster_id": "N_475",
    "street_name": "Donaustraße",
    "plz": "41469",
    "address_range": "1 - 118",
    "building_count_total": 66,
    "sfh_total_ratio": 0.9848,
    "mfh_ratio": 0.0,
    "other_ratio": 0.0152,
    "structure_profile": "SFH_DOMINANT",
    "structure_gate": "PASS",
    "gate_reason": "LOW_MFH_HIGH_SFH",
    "general_rank_score": 0.7688,
    "general_rank": 10,
    "general_band": "HIGH",
    "ranking_reason_primary": "HIGH_SFH_RATIO",
    "ranking_reason_secondary": "NONE",
    "ranking_universe": "PASS_ONLY"
  },
  {
    "cluster_id": "N_417",
    "street_name": "Im Stüttgesfeld",
    "plz": "41470",
    "address_range": "32c - 84",
    "building_count_total": 51,
    "sfh_total_ratio": 1.0,
    "mfh_ratio": 0.0,
    "other_ratio": 0.0,
    "structure_profile": "SFH_DOMINANT",
    "structure_gate": "PASS",
    "gate_reason": "LOW_MFH_HIGH_SFH",
    "general_rank_score": 0.7676,
    "general_rank": 11,
    "general_band": "HIGH",
    "ranking_reason_primary": "HIGH_SFH_RATIO",
    "ranking_reason_secondary": "NONE",
    "ranking_universe": "PASS_ONLY"
  },
  {
    "cluster_id": "N_012",
    "street_name": "Im Melchersfeld",
    "plz": "41468",
    "address_range": "1 - 60",
    "building_count_total": 48,
    "sfh_total_ratio": 1.0,
    "mfh_ratio": 0.0,
    "other_ratio": 0.0,
    "structure_profile": "SFH_DOMINANT",
    "structure_gate": "PASS",
    "gate_reason": "LOW_MFH_HIGH_SFH",
    "general_rank_score": 0.7634,
    "general_rank": 12,
    "general_band": "HIGH",
    "ranking_reason_primary": "HIGH_SFH_RATIO",
    "ranking_reason_secondary": "NONE",
    "ranking_universe": "PASS_ONLY"
  },
  {
    "cluster_id": "N_323",
    "street_name": "Emsstraße",
    "plz": "41469",
    "address_range": "1 - 67",
    "building_count_total": 45,
    "sfh_total_ratio": 1.0,
    "mfh_ratio": 0.0,
    "other_ratio": 0.0,
    "structure_profile": "SFH_DOMINANT",
    "structure_gate": "PASS",
    "gate_reason": "LOW_MFH_HIGH_SFH",
    "general_rank_score": 0.7592,
    "general_rank": 13,
    "general_band": "HIGH",
    "ranking_reason_primary": "HIGH_SFH_RATIO",
    "ranking_reason_secondary": "NONE",
    "ranking_universe": "PASS_ONLY"
  },
  {
    "cluster_id": "N_421",
    "street_name": "Wolfskamphof",
    "plz": "41470",
    "address_range": "25 - 87",
    "building_count_total": 45,
    "sfh_total_ratio": 1.0,
    "mfh_ratio": 0.0,
    "other_ratio": 0.0,
    "structure_profile": "SFH_DOMINANT",
    "structure_gate": "PASS",
    "gate_reason": "LOW_MFH_HIGH_SFH",
    "general_rank_score": 0.7592,
    "general_rank": 14,
    "general_band": "HIGH",
    "ranking_reason_primary": "HIGH_SFH_RATIO",
    "ranking_reason_secondary": "NONE",
    "ranking_universe": "PASS_ONLY"
  },
  {
    "cluster_id": "N_451",
    "street_name": "Am Linckhof",
    "plz": "41470",
    "address_range": "16 - 90",
    "building_count_total": 45,
    "sfh_total_ratio": 1.0,
    "mfh_ratio": 0.0,
    "other_ratio": 0.0,
    "structure_profile": "SFH_DOMINANT",
    "structure_gate": "PASS",
    "gate_reason": "LOW_MFH_HIGH_SFH",
    "general_rank_score": 0.7592,
    "general_rank": 15,
    "general_band": "HIGH",
    "ranking_reason_primary": "HIGH_SFH_RATIO",
    "ranking_reason_secondary": "NONE",
    "ranking_universe": "PASS_ONLY"
  },
  {
    "cluster_id": "N_507",
    "street_name": "Stephanusstraße",
    "plz": "41472",
    "address_range": "1 - 67",
    "building_count_total": 45,
    "sfh_total_ratio": 1.0,
    "mfh_ratio": 0.0,
    "other_ratio": 0.0,
    "structure_profile": "SFH_DOMINANT",
    "structure_gate": "PASS",
    "gate_reason": "LOW_MFH_HIGH_SFH",
    "general_rank_score": 0.7592,
    "general_rank": 16,
    "general_band": "HIGH",
    "ranking_reason_primary": "HIGH_SFH_RATIO",
    "ranking_reason_secondary": "NONE",
    "ranking_universe": "PASS_ONLY"
  },
  {
    "cluster_id": "N_258",
    "street_name": "Mergelsweg",
    "plz": "41472",
    "address_range": "1 - 93",
    "building_count_total": 60,
    "sfh_total_ratio": 0.9833,
    "mfh_ratio": 0.0167,
    "other_ratio": 0.0,
    "structure_profile": "SFH_DOMINANT",
    "structure_gate": "PASS",
    "gate_reason": "LOW_MFH_HIGH_SFH",
    "general_rank_score": 0.7499,
    "general_rank": 17,
    "general_band": "HIGH",
    "ranking_reason_primary": "HIGH_SFH_RATIO",
    "ranking_reason_secondary": "NONE",
    "ranking_universe": "PASS_ONLY"
  },
  {
    "cluster_id": "N_222",
    "street_name": "Lippestraße",
    "plz": "41469",
    "address_range": "1 - 46",
    "building_count_total": 38,
    "sfh_total_ratio": 1.0,
    "mfh_ratio": 0.0,
    "other_ratio": 0.0,
    "structure_profile": "SFH_DOMINANT",
    "structure_gate": "PASS",
    "gate_reason": "LOW_MFH_HIGH_SFH",
    "general_rank_score": 0.7493,
    "general_rank": 18,
    "general_band": "HIGH",
    "ranking_reason_primary": "HIGH_SFH_RATIO",
    "ranking_reason_secondary": "NONE",
    "ranking_universe": "PASS_ONLY"
  },
  {
    "cluster_id": "N_042",
    "street_name": "Fliederweg",